{
  "schema_version": 1,
  "description": "Complete active registry for every bounded, unsupported, excluded, or falsified claim in data/registry/unified_framework_claims.json. It does not claim automatic coverage of arbitrary prose outside that bounded canonical ledger. Falsified claims remain as lineage for explicitly new replacement hypotheses.",
  "source_claim_statuses": ["bounded", "excluded", "falsified", "unsupported"],
  "promotion_policy": {
    "paper_admission_rule": "A computational or empirical hypothesis result may enter the manuscript only when its locked decision rule is evaluated and paper_promotion is eligible or promoted.",
    "independent_reproduction_rule": "Every supported or negative computational or empirical result requires reproduction from a clean environment by a runner independent of the generating run before promotion.",
    "literature_rule": "Literature is admitted only when it directly defines, constrains, tests, or falsifies a registered hypothesis; literature cannot substitute for repository evidence."
  },
  "hypotheses": [
    {
      "id": "hyp_higher_cayley_dickson_observable",
      "title": "Higher Cayley-Dickson zero-divisor observable",
      "program_id": "foundational_backlog",
      "source_claim_ids": ["higher_cayley_dickson_physical_mapping"],
      "formal_statement": "For declared state spaces X_ZD and X_0, dynamics Phi_t, and measurement Y, an intervention that changes only zero-divisor structure produces a nonzero preregistered contrast E[Y(Phi_t(X_ZD)) - Y(Phi_t(X_0))].",
      "observable_predictions": [
        {
          "id": "zero_divisor_contrast",
          "observable": "Matched difference in the declared response Y",
          "expected_relation": "The confidence interval excludes zero and exceeds the preregistered minimum effect.",
          "measurement_method": "Run identical dynamics on algebraic and algebra-free states matched for spectrum, energy, dimension, parameter count, and conditioning."
        }
      ],
      "controls": [
        "Algebra-free state with matched spectrum and energy",
        "Basis-scrambled multiplication table",
        "Parameter-count- and conditioning-matched surrogate"
      ],
      "falsification_thresholds": [
        "Falsify the physical mapping if the corrected 95 percent confidence interval contains zero.",
        "Falsify specificity if any matched surrogate reproduces the effect within the preregistered equivalence margin."
      ],
      "required_evidence": [
        {
          "kind": "definition",
          "description": "Typed physical state map, intervention, dynamics, observable, units, and nuisance parameters",
          "status": "missing",
          "artifact_paths": []
        },
        {
          "kind": "derivation",
          "description": "Algebra-to-observable mechanism with dimensional consistency",
          "status": "missing",
          "artifact_paths": []
        },
        {
          "kind": "control",
          "description": "Matched algebra-free and scrambled-label controls",
          "status": "planned",
          "artifact_paths": []
        },
        {
          "kind": "literature",
          "description": "Algebraic boundary and zero-divisor foundations",
          "status": "present",
          "artifact_paths": ["data/external/sources.toml"]
        },
        {
          "kind": "replication",
          "description": "Independent reproduction after a primary result exists",
          "status": "external_required",
          "artifact_paths": []
        }
      ],
      "implementation_status": "design_only",
      "research_status": "blocked",
      "literature_source_ids": ["arxiv_baez_math_0105155", "arxiv_moreno_math_0512517"],
      "independent_reproduction": {"required": true, "status": "pending", "evidence_paths": []},
      "paper_promotion": "prohibited"
    },
    {
      "id": "hyp_e10_e11_truncation_dictionary",
      "title": "Finite E10 or E11 supergravity dictionary",
      "program_id": "foundational_backlog",
      "source_claim_ids": ["e10_e11_supergravity_scope"],
      "formal_statement": "For a fixed algebra, level or height cutoff L, and explicit dictionary phi_L, every declared algebraic equation maps to the named supergravity equation through L, with the first unmatched term recorded.",
      "observable_predictions": [
        {
          "id": "truncation_residual",
          "observable": "Symbolic residual of each mapped equation through cutoff L",
          "expected_relation": "Every in-scope residual simplifies exactly to zero and the first out-of-scope mismatch is identified.",
          "measurement_method": "Evaluate the locked dictionary symbolically and compare term-by-term with the declared supergravity truncation."
        }
      ],
      "controls": ["Label-shuffled dictionary", "Competing dictionary with the same number of free correspondences"],
      "falsification_thresholds": [
        "One nonzero exact residual within the declared cutoff falsifies the stated dictionary.",
        "Instability of previously matched terms when L is increased falsifies truncation stability."
      ],
      "required_evidence": [
        {"kind": "definition", "description": "Explicit algebra, real form, truncation, variables, and typed dictionary", "status": "missing", "artifact_paths": []},
        {"kind": "derivation", "description": "Term-by-term symbolic equation map", "status": "missing", "artifact_paths": []},
        {"kind": "literature", "description": "Foundational E10 and E11 supergravity proposals", "status": "present", "artifact_paths": ["data/external/sources.toml"]},
        {"kind": "control", "description": "Dictionary specificity controls", "status": "planned", "artifact_paths": []},
        {"kind": "replication", "description": "Independent symbolic reproduction", "status": "external_required", "artifact_paths": []}
      ],
      "implementation_status": "design_only",
      "research_status": "blocked",
      "literature_source_ids": ["arxiv_damour_e10_0207267", "arxiv_west_e11_0104081"],
      "independent_reproduction": {"required": true, "status": "pending", "evidence_paths": []},
      "paper_promotion": "prohibited"
    },
    {
      "id": "hyp_moonshine_stability_operator",
      "title": "Moonshine-specific stability operator",
      "program_id": "foundational_backlog",
      "source_claim_ids": ["monstrous_moonshine_stability"],
      "formal_statement": "A declared Monster representation rho and evolution U_t preserve a named invariant and improve a preregistered stability functional relative to equal-dimensional non-Monster controls.",
      "observable_predictions": [
        {
          "id": "stability_margin",
          "observable": "Difference in the declared Lyapunov or norm-growth bound",
          "expected_relation": "The Monster construction improves the bound beyond the locked minimum margin.",
          "measurement_method": "Evaluate the same evolution and perturbation ensemble under Monster, non-Monster, and label-shuffled representations."
        }
      ],
      "controls": ["Equal-dimensional non-Monster representation", "Label-shuffled representation", "Invariant-disabled ablation"],
      "falsification_thresholds": [
        "Failure of the claimed commutation or invariant relation falsifies the mechanism.",
        "A corrected confidence interval overlapping the locked equivalence margin falsifies a stability advantage."
      ],
      "required_evidence": [
        {"kind": "definition", "description": "Representation, evolution, invariant, perturbation ensemble, and stability functional", "status": "missing", "artifact_paths": []},
        {"kind": "derivation", "description": "Proof linking the representation to the stability inequality", "status": "missing", "artifact_paths": []},
        {"kind": "literature", "description": "Moonshine theorem and modern representation foundations", "status": "present", "artifact_paths": ["data/external/sources.toml"]},
        {"kind": "control", "description": "Equal-capacity alternative representation controls", "status": "planned", "artifact_paths": []},
        {"kind": "replication", "description": "Independent computational reproduction", "status": "external_required", "artifact_paths": []}
      ],
      "implementation_status": "design_only",
      "research_status": "blocked",
      "literature_source_ids": ["borcherds_monstrous_moonshine_1992", "arxiv_duncan_griffin_ono_1411_6571"],
      "independent_reproduction": {"required": true, "status": "pending", "evidence_paths": []},
      "paper_promotion": "prohibited"
    },
    {
      "id": "hyp_fractal_estimator_convergence",
      "title": "Fractal estimator convergence under refinement",
      "program_id": "foundational_backlog",
      "source_claim_ids": ["fractal_estimator_convergence"],
      "formal_statement": "For exact-dimension controls and declared estimators, absolute error decreases under resolution refinement and remains stable under adjacent scale-window choices.",
      "observable_predictions": [
        {
          "id": "maximum_dimension_error",
          "observable": "Maximum absolute dimension error across locked exact controls",
          "expected_relation": "The retained refinement series reaches error below 0.02 without a worsening terminal trend.",
          "measurement_method": "Run box-counting and comparison estimators on Cantor, Sierpinski, Koch, and nonfractal controls at preregistered resolutions and scale windows."
        }
      ],
      "controls": ["Cantor set", "Sierpinski triangle", "Koch curve", "Nonfractal line and plane"],
      "falsification_thresholds": [
        "Falsify convergence if maximum absolute error remains at or above 0.02 at the terminal preregistered resolution.",
        "Falsify scale stability if adjacent admissible windows shift the estimate by 0.02 or more."
      ],
      "required_evidence": [